{
  "case_id": "CASE-03",
  "edges": [
    {
      "predicate": "aboutCase",
      "source": "http://example.org/kg-mnp#Assessment-CASE-03",
      "source_local": "Assessment-CASE-03",
      "target": "http://example.org/kg-mnp#Case-CASE-03",
      "target_local": "Case-CASE-03"
    },
    {
      "predicate": "dependsOn",
      "source": "http://example.org/kg-mnp#Assessment-CASE-03",
      "source_local": "Assessment-CASE-03",
      "target": "http://example.org/kg-mnp#Dep-CASE-03",
      "target_local": "Dep-CASE-03"
    },
    {
      "predicate": "evaluatedByRule",
      "source": "http://example.org/kg-mnp#Assessment-CASE-03",
      "source_local": "Assessment-CASE-03",
      "target": "http://example.org/kg-mnp#Rule-MNP-ELIG-001",
      "target_local": "Rule-MNP-ELIG-001"
    },
    {
      "predicate": "evaluatedByRule",
      "source": "http://example.org/kg-mnp#Assessment-CASE-03",
      "source_local": "Assessment-CASE-03",
      "target": "http://example.org/kg-mnp#Rule-MNP-ELIG-002",
      "target_local": "Rule-MNP-ELIG-002"
    },
    {
      "predicate": "evaluatedByRule",
      "source": "http://example.org/kg-mnp#Assessment-CASE-03",
      "source_local": "Assessment-CASE-03",
      "target": "http://example.org/kg-mnp#Rule-MNP-ELIG-003",
      "target_local": "Rule-MNP-ELIG-003"
    },
    {
      "predicate": "evaluatedByRule",
      "source": "http://example.org/kg-mnp#Assessment-CASE-03",
      "source_local": "Assessment-CASE-03",
      "target": "http://example.org/kg-mnp#Rule-MNP-ELIG-004",
      "target_local": "Rule-MNP-ELIG-004"
    },
    {
      "predicate": "evaluatedByRule",
      "source": "http://example.org/kg-mnp#Assessment-CASE-03",
      "source_local": "Assessment-CASE-03",
      "target": "http://example.org/kg-mnp#Rule-MNP-ELIG-005-v1-1",
      "target_local": "Rule-MNP-ELIG-005-v1-1"
    },
    {
      "predicate": "producesBlockingReason",
      "source": "http://example.org/kg-mnp#Assessment-CASE-03",
      "source_local": "Assessment-CASE-03",
      "target": "http://example.org/kg-mnp#Reason-CASE-03-ACTIVE_CONTRACT_RESTRICTION",
      "target_local": "Reason-CASE-03-ACTIVE_CONTRACT_RESTRICTION"
    },
    {
      "predicate": "producesDecision",
      "source": "http://example.org/kg-mnp#Assessment-CASE-03",
      "source_local": "Assessment-CASE-03",
      "target": "http://example.org/kg-mnp#Decision-CASE-03",
      "target_local": "Decision-CASE-03"
    },
    {
      "predicate": "usesEvidence",
      "source": "http://example.org/kg-mnp#Assessment-CASE-03",
      "source_local": "Assessment-CASE-03",
      "target": "http://example.org/kg-mnp#Evidence-CASE-03-BILLING",
      "target_local": "Evidence-CASE-03-BILLING"
    },
    {
      "predicate": "usesEvidence",
      "source": "http://example.org/kg-mnp#Assessment-CASE-03",
      "source_local": "Assessment-CASE-03",
      "target": "http://example.org/kg-mnp#Evidence-CASE-03-CONTRACT",
      "target_local": "Evidence-CASE-03-CONTRACT"
    },
    {
      "predicate": "usesEvidence",
      "source": "http://example.org/kg-mnp#Assessment-CASE-03",
      "source_local": "Assessment-CASE-03",
      "target": "http://example.org/kg-mnp#Evidence-CASE-03-IDENTITY",
      "target_local": "Evidence-CASE-03-IDENTITY"
    },
    {
      "predicate": "usesEvidence",
      "source": "http://example.org/kg-mnp#Assessment-CASE-03",
      "source_local": "Assessment-CASE-03",
      "target": "http://example.org/kg-mnp#Evidence-CASE-03-NUMBER",
      "target_local": "Evidence-CASE-03-NUMBER"
    },
    {
      "predicate": "usesEvidence",
      "source": "http://example.org/kg-mnp#Assessment-CASE-03",
      "source_local": "Assessment-CASE-03",
      "target": "http://example.org/kg-mnp#Evidence-CASE-03-PORTING",
      "target_local": "Evidence-CASE-03-PORTING"
    },
    {
      "predicate": "usesRuleVersion",
      "source": "http://example.org/kg-mnp#Assessment-CASE-03",
      "source_local": "Assessment-CASE-03",
      "target": "http://example.org/kg-mnp#RuleVersion-MNP-ELIG-001-1-0",
      "target_local": "RuleVersion-MNP-ELIG-001-1-0"
    },
    {
      "predicate": "usesRuleVersion",
      "source": "http://example.org/kg-mnp#Assessment-CASE-03",
      "source_local": "Assessment-CASE-03",
      "target": "http://example.org/kg-mnp#RuleVersion-MNP-ELIG-002-1-0",
      "target_local": "RuleVersion-MNP-ELIG-002-1-0"
    },
    {
      "predicate": "usesRuleVersion",
      "source": "http://example.org/kg-mnp#Assessment-CASE-03",
      "source_local": "Assessment-CASE-03",
      "target": "http://example.org/kg-mnp#RuleVersion-MNP-ELIG-003-1-0",
      "target_local": "RuleVersion-MNP-ELIG-003-1-0"
    },
    {
      "predicate": "usesRuleVersion",
      "source": "http://example.org/kg-mnp#Assessment-CASE-03",
      "source_local": "Assessment-CASE-03",
      "target": "http://example.org/kg-mnp#RuleVersion-MNP-ELIG-004-1-0",
      "target_local": "RuleVersion-MNP-ELIG-004-1-0"
    },
    {
      "predicate": "usesRuleVersion",
      "source": "http://example.org/kg-mnp#Assessment-CASE-03",
      "source_local": "Assessment-CASE-03",
      "target": "http://example.org/kg-mnp#RuleVersion-MNP-ELIG-005-1-1",
      "target_local": "RuleVersion-MNP-ELIG-005-1-1"
    },
    {
      "predicate": "hasEligibilityAssessment",
      "source": "http://example.org/kg-mnp#Case-CASE-03",
      "source_local": "Case-CASE-03",
      "target": "http://example.org/kg-mnp#Assessment-CASE-03",
      "target_local": "Assessment-CASE-03"
    },
    {
      "predicate": "partOfDocument",
      "source": "http://example.org/kg-mnp#Clause-01",
      "source_local": "Clause-01",
      "target": "http://example.org/kg-mnp#Doc-MNP-Regulation-2024",
      "target_local": "Doc-MNP-Regulation-2024"
    },
    {
      "predicate": "partOfDocument",
      "source": "http://example.org/kg-mnp#Clause-02",
      "source_local": "Clause-02",
      "target": "http://example.org/kg-mnp#Doc-MNP-Regulation-2024",
      "target_local": "Doc-MNP-Regulation-2024"
    },
    {
      "predicate": "partOfDocument",
      "source": "http://example.org/kg-mnp#Clause-03",
      "source_local": "Clause-03",
      "target": "http://example.org/kg-mnp#Doc-MNP-Regulation-2024",
      "target_local": "Doc-MNP-Regulation-2024"
    },
    {
      "predicate": "partOfDocument",
      "source": "http://example.org/kg-mnp#Clause-04",
      "source_local": "Clause-04",
      "target": "http://example.org/kg-mnp#Doc-MNP-Regulation-2024",
      "target_local": "Doc-MNP-Regulation-2024"
    },
    {
      "predicate": "partOfDocument",
      "source": "http://example.org/kg-mnp#Clause-05",
      "source_local": "Clause-05",
      "target": "http://example.org/kg-mnp#Doc-MNP-Regulation-2024",
      "target_local": "Doc-MNP-Regulation-2024"
    },
    {
      "predicate": "dependsOnEvidence",
      "source": "http://example.org/kg-mnp#Dep-CASE-03",
      "source_local": "Dep-CASE-03",
      "target": "http://example.org/kg-mnp#Evidence-CASE-03-BILLING",
      "target_local": "Evidence-CASE-03-BILLING"
    },
    {
      "predicate": "dependsOnEvidence",
      "source": "http://example.org/kg-mnp#Dep-CASE-03",
      "source_local": "Dep-CASE-03",
      "target": "http://example.org/kg-mnp#Evidence-CASE-03-CONTRACT",
      "target_local": "Evidence-CASE-03-CONTRACT"
    },
    {
      "predicate": "dependsOnEvidence",
      "source": "http://example.org/kg-mnp#Dep-CASE-03",
      "source_local": "Dep-CASE-03",
      "target": "http://example.org/kg-mnp#Evidence-CASE-03-IDENTITY",
      "target_local": "Evidence-CASE-03-IDENTITY"
    },
    {
      "predicate": "dependsOnEvidence",
      "source": "http://example.org/kg-mnp#Dep-CASE-03",
      "source_local": "Dep-CASE-03",
      "target": "http://example.org/kg-mnp#Evidence-CASE-03-NUMBER",
      "target_local": "Evidence-CASE-03-NUMBER"
    },
    {
      "predicate": "dependsOnEvidence",
      "source": "http://example.org/kg-mnp#Dep-CASE-03",
      "source_local": "Dep-CASE-03",
      "target": "http://example.org/kg-mnp#Evidence-CASE-03-PORTING",
      "target_local": "Evidence-CASE-03-PORTING"
    },
    {
      "predicate": "dependsOnRuleVersion",
      "source": "http://example.org/kg-mnp#Dep-CASE-03",
      "source_local": "Dep-CASE-03",
      "target": "http://example.org/kg-mnp#RuleVersion-MNP-ELIG-001-1-0",
      "target_local": "RuleVersion-MNP-ELIG-001-1-0"
    },
    {
      "predicate": "dependsOnRuleVersion",
      "source": "http://example.org/kg-mnp#Dep-CASE-03",
      "source_local": "Dep-CASE-03",
      "target": "http://example.org/kg-mnp#RuleVersion-MNP-ELIG-002-1-0",
      "target_local": "RuleVersion-MNP-ELIG-002-1-0"
    },
    {
      "predicate": "dependsOnRuleVersion",
      "source": "http://example.org/kg-mnp#Dep-CASE-03",
      "source_local": "Dep-CASE-03",
      "target": "http://example.org/kg-mnp#RuleVersion-MNP-ELIG-003-1-0",
      "target_local": "RuleVersion-MNP-ELIG-003-1-0"
    },
    {
      "predicate": "dependsOnRuleVersion",
      "source": "http://example.org/kg-mnp#Dep-CASE-03",
      "source_local": "Dep-CASE-03",
      "target": "http://example.org/kg-mnp#RuleVersion-MNP-ELIG-004-1-0",
      "target_local": "RuleVersion-MNP-ELIG-004-1-0"
    },
    {
      "predicate": "dependsOnRuleVersion",
      "source": "http://example.org/kg-mnp#Dep-CASE-03",
      "source_local": "Dep-CASE-03",
      "target": "http://example.org/kg-mnp#RuleVersion-MNP-ELIG-005-1-1",
      "target_local": "RuleVersion-MNP-ELIG-005-1-1"
    },
    {
      "predicate": "citesClause",
      "source": "http://example.org/kg-mnp#Reason-CASE-03-ACTIVE_CONTRACT_RESTRICTION",
      "source_local": "Reason-CASE-03-ACTIVE_CONTRACT_RESTRICTION",
      "target": "http://example.org/kg-mnp#Clause-04",
      "target_local": "Clause-04"
    },
    {
      "predicate": "recommendsAction",
      "source": "http://example.org/kg-mnp#Reason-CASE-03-ACTIVE_CONTRACT_RESTRICTION",